{
  "$schema": "http://json-schema.org/draft-07/schema#",
  "title": "SVC product-safe implementation plan contract",
  "type": "object",
  "required": ["schema_version", "manifest", "ownership", "resource_review", "resource_writers", "claims", "executables"],
  "properties": {
    "schema_version": { "const": 1 },
    "manifest": { "type": "string" },
    "base_sha": { "type": "string", "minLength": 1 },
    "ownership": { "type": "array" },
    "resource_review": {
      "type": "object",
      "required": ["verification", "denominator", "disposition", "evidence"],
      "properties": {
        "verification": { "const": "changed-executable-census" },
        "denominator": { "type": "integer", "minimum": 0 },
        "disposition": { "enum": ["no-risky-resource-writers", "declared-risky-resource-writers"] },
        "evidence": { "type": "string", "minLength": 1 }
      }
    },
    "resource_writers": { "type": "array" },
    "claims": {
      "type": "array",
      "items": {
        "type": "object",
        "required": ["kind", "evidence", "denominator"],
        "properties": {
          "kind": { "enum": ["absence", "complete", "all", "unused"] },
          "denominator": { "type": "integer", "minimum": 0 },
          "evidence": {
            "type": "object",
            "required": ["artifact", "verification"],
            "properties": {
              "artifact": { "type": "string", "minLength": 1 },
              "verification": { "enum": ["source-ledger-count", "triage-direct-proposals", "diff-manifest-parity", "executable-consumers"] }
            }
          }
        }
      }
    },
    "executables": {
      "type": "array",
      "items": {
        "type": "object",
        "required": ["path", "consumers"],
        "properties": {
          "path": { "type": "string", "minLength": 1 },
          "consumers": {
            "type": "array", "minItems": 1,
            "items": { "type": "object", "required": ["path", "query"], "properties": { "path": { "type": "string", "minLength": 1 }, "query": { "type": "string", "minLength": 1 } } }
          }
        }
      }
    }
  }
}
