{
  "schema_version": 1,
  "manifest": "docs/plans/2026-08-15-wi541-full-framework-transition/manifest.md",
  "base_sha": "ec625b9a57dc2ccc8d01f0bcc7c86548bb0cf9c9",
  "ownership": [
    { "task": "T01", "paths": ["docs/specs/evidence/wi-541-source-ledger.json", "test-framework/evals/tier-1/validate-wi541-source-ledger.mjs", "proposals/done/2026-08-15-evolution-hoursHub-transition.md", "proposals/done/2026-08-15-framework-improvement-mandatory-chain-graph-parity.md", "docs/specs/work-items/WI-541-residual-map.json", "proposals/triage.json", "test-framework/evals/tier-1/validate-proposal-triage-sla.sh", "docs/specs/work-items/PROPOSAL-PROMOTION-LEDGER.md"] },
    { "task": "T02", "paths": ["scripts/lib/mandatory-delivery-chain.mjs", "test-framework/evals/tier-1/validate-mandatory-delivery-chain.sh", "scripts/compile-delivery-graph.mjs", "scripts/validate-delivery-graph.mjs", "scripts/validate-task-graph-lane.mjs", "scripts/classify-delivery-graph-closeout.mjs", "skills/route-workflow/references/lane-model.md", "test-framework/evals/tier-1/validate-delivery-graph-compiler.sh", "test-framework/evals/tier-1/validate-delivery-graph-replay-autorun.sh", "test-framework/evals/tier-1/validate-delivery-graph-closeout-classification.sh"] },
    { "task": "T03", "paths": ["hooks/lib/bash-mutation-targets.mjs", "references/concrete-path-guard-inventory.md", "test-framework/evals/tier-1/validate-concrete-path-bash-guards.sh", "hooks/svc-workflow-guard.mjs", "hooks/svc-skill-artifact-authenticity.mjs", "hooks/svc-session-contract-freshness.mjs", "hooks/hooks.json", "hooks/svc-worktree-isolation-guard.mjs", "hooks/svc-impact-triad-guard.mjs", "test-framework/evals/tier-1/validate-g4-skill-artifact-authenticity.sh"] },
    { "task": "T04", "paths": ["scripts/resolve-child-transport.mjs", "test-framework/evals/tier-1/validate-child-transport-resolver.mjs", "hooks/lib/delegation-authority.mjs", "skills/execute-changeset/SKILL.md", "skills/execute-changeset/references/subagent-dispatch.md", "skills/dispatch-waves/SKILL.md", "provision/hosts/codex.json", "scripts/dispatch-worker.sh", "scripts/dispatch-execution-task.mjs", "scripts/svc-contained-exec.mjs", "scripts/validate-execution-merge-back.mjs", "test-framework/evals/tier-1/validate-parallel-wi-dispatch.sh", "test-framework/evals/tier-1/validate-delegated-execution-authority.sh"] },
    { "task": "T05", "paths": ["hooks/codex/lib/promotion-capability.mjs", "test-framework/evals/tier-1/validate-promotion-authority.sh", "scripts/svc-owner-recovery.mjs", "scripts/svc-ensure-worktree.mjs", "scripts/merge-pr-with-review-receipt.mjs", "skills/verify-promotion/SKILL.md", "test-framework/evals/tier-1/validate-existing-worktree-self-heal.sh"] },
    { "task": "T06", "paths": ["scripts/validate-plan-contract.mjs", "scripts/find-callers.mjs", "scripts/lib/reviewer-evidence.mjs", "scripts/lib/external-review-provenance.mjs", "schemas/plan-contract.schema.json", "docs/plans/2026-08-15-wi541-full-framework-transition/plan-contract.json", "test-framework/evals/tier-1/validate-plan-product-safety.sh", "test-framework/evals/tier-1/validate-reviewer-run-evidence.sh", "test-framework/evals/tier-1/fixtures/external-review-fixture.mjs", "docs/plans/2026-08-15-wi541-full-framework-transition/manifest.md", "docs/plans/2026-08-15-wi541-full-framework-transition/review-log.yaml", "scripts/verify-plan-mechanical.sh", "scripts/emit-receipt.mjs", "skills/plan-changeset/SKILL.md", "skills/review-plan/SKILL.md", "skills/review-exec/SKILL.md", "scripts/run-external-review.mjs", "schemas/external-review-receipt.schema.json", "schemas/receipts/review-plan.schema.json", "schemas/receipts/review-exec.schema.json", "scripts/check-chain-receipts.mjs", "test-framework/evals/tier-1/validate-receipt-tier.sh", "test-framework/evals/tier-1/validate-receipt-sha-pinning.sh", "test-framework/evals/tier-1/validate-retroactive-attestation.sh", "test-framework/evals/tier-1/validate-review-topology-v2.mjs", "test-framework/evals/tier-1/validate-external-review-launcher.sh", "test-framework/evals/tier-1/validate-chain-receipts-schema.sh"] },
    { "task": "T07", "paths": ["scripts/learning-lifecycle.mjs", "test-framework/evals/tier-1/validate-learning-lifecycle.sh", "hooks/lib/learning-index.mjs", "hooks/svc-learning-inject.mjs", "skills/manage-learnings/SKILL.md", "skills/recall-stack-knowledge/SKILL.md", "skills/land-changeset/SKILL.md", "skills/evaluate-rule/SKILL.md", "scripts/promote-auto-learnings.mjs", "test-framework/evals/tier-1/validate-auto-learning-promote-replay.sh"] },
    { "task": "T08", "paths": ["scripts/svc-authorized-action.mjs", "references/authorization-envelope.md", "test-framework/evals/tier-1/validate-authorization-envelope.sh", "_shared/session-contract.md", "hooks/codex/svc-codex-pretool-dispatcher.mjs", "hooks/svc-auto-capture-learnings.mjs"] },
    { "task": "T09", "paths": ["scripts/lib/stage-registry.mjs", "test-framework/evals/tier-1/validate-task-graph-concurrency.sh", "test-framework/evals/tier-1/validate-stage-registry-single-source.sh", "scripts/task-graph.mjs", "scripts/audit-story-receipts.mjs", "scripts/stage-activation.mjs", "skills/write-spec/SKILL.md", "skills/route-workflow/SKILL.md", "scripts/svc-auto-drive.mjs", "scripts/kimi-e2e-test.mjs", "scripts/scenario-runner.mjs", "docs/specs/plans/FRAMEWORK_OPTIMIZATION_PLAN.md", "schemas/receipts/verify-promotion.schema.json", "test-framework/evals/tier-1/validate-route-workflow-hot-path-size.sh", "test-framework/evals/tier-1/validate-g1-lane-tasks-edit-guard.sh", "test-framework/evals/tier-1/validate-state-io-discipline.sh"] },
    { "task": "T10", "paths": ["skills-manifest.json", "README.md", "AGENTS.md", "KIMI.md", "GEMINI.md", "ANTIGRAVITY.md", "skills/route-workflow/references/routing-rules.md", "test-framework/evals/tier-1/validate-quick-fix-retirement.sh"] },
    { "task": "T11", "paths": ["FRAMEWORK-STATE.md", "docs/specs/work-items/WI-541.md", "docs/specs/work-items/INDEX.md", "docs/specs/features/wi-541-full-transition.md", "docs/specs/tech/wi-541-full-transition.md", "docs/specs/decisions/wi-541-full-transition.md", "docs/specs/decisions/wi-541-solution-confidence/SOLUTION-CONFIDENCE.md", "docs/specs/explorations/wi-541-full-transition/PROBLEM_BRIEF.md", "docs/specs/explorations/wi-541-full-transition/SOLUTION_MAP.md", "docs/specs/explorations/wi-541-full-transition/ANALYSIS.md", "docs/specs/explorations/wi-541-full-transition/DECISION.md", "docs/specs/relations/wi-541-full-transition.branches.md", "docs/specs/relations/wi-541-full-transition.branches.md.imports.json", ".svc/spec-index.json", "docs/specs/research-log.md", "references/knowledge/domains/codex-hooks/CAPABILITIES.md", "references/knowledge/domains/codex-hooks/details/events.md", "references/knowledge/domains/codex-hooks/.sources.jsonl", "docs/specs/audit/wi-541-consumption-audit.md", "docs/specs/audit/wi-541-security-review.md", "docs/specs/audit/wi-541-session-audit.md", ".svc/feature-graph-WI-541.json", ".svc/lane-tasks-WI-541.json", ".svc/pipeline-decisions.jsonl", ".svc/session-contract.jsonl", ".svc/competitive-monitor-triggers.jsonl"] }
  ],
  "resource_review": {
    "verification": "changed-executable-census",
    "denominator": 74,
    "disposition": "no-risky-resource-writers",
    "evidence": "All changed executable paths were enumerated from the base_sha diff; this framework-only change has no money, ledger, subscription, entitlement, quota, counter, inventory, identity, or notification writer."
  },
  "resource_writers": [],
  "claims": [
    { "kind": "complete", "evidence": { "artifact": "docs/specs/evidence/wi-541-source-ledger.json", "verification": "source-ledger-count" }, "denominator": 22 },
    { "kind": "all", "evidence": { "artifact": "proposals/triage.json", "verification": "triage-direct-proposals" }, "denominator": 43 },
    { "kind": "absence", "evidence": { "artifact": "docs/plans/2026-08-15-wi541-full-framework-transition/manifest.md", "verification": "diff-manifest-parity" }, "denominator": 0 },
    { "kind": "unused", "evidence": { "artifact": "docs/specs/audit/wi-541-consumption-audit.md", "verification": "executable-consumers" }, "denominator": 0 }
  ],
  "executables": [
    { "path": "scripts/resolve-child-transport.mjs", "consumers": [{"path":"scripts/dispatch-worker.sh","query":"resolve-child-transport.mjs"},{"path":"test-framework/evals/tier-1/validate-child-transport-resolver.mjs","query":"resolveChildTransport"}] },
    { "path": "scripts/validate-plan-contract.mjs", "consumers": [{"path":"scripts/verify-plan-mechanical.sh","query":"validate-plan-contract.mjs"},{"path":"test-framework/evals/tier-1/validate-plan-product-safety.sh","query":"validatePlanContract"}] },
    { "path": "scripts/find-callers.mjs", "consumers": [{"path":"test-framework/evals/tier-1/validate-plan-product-safety.sh","query":"find-callers.mjs"},{"path":"skills/review-exec/SKILL.md","query":"find-callers.mjs"}] },
    { "path": "scripts/learning-lifecycle.mjs", "consumers": [{"path":"scripts/promote-auto-learnings.mjs","query":"learning-lifecycle"},{"path":"test-framework/evals/tier-1/validate-learning-lifecycle.sh","query":"learning-lifecycle.mjs"}] },
    { "path": "scripts/svc-authorized-action.mjs", "consumers": [{"path":"hooks/codex/svc-codex-pretool-dispatcher.mjs","query":"svc-authorized-action.mjs"},{"path":"test-framework/evals/tier-1/validate-authorization-envelope.sh","query":"svc-authorized-action.mjs"}] }
  ]
}
